Guide File,Pin Title,Pin Description,Image URL Placeholder,Link
gif-to-png-guide-5.html,How to Convert an Image to Base64: A Simple Guide,Embed images directly into your HTML or CSS code! Our step-by-step guide shows you how to convert any image to Base64 format to reduce server requests and speed up your site. #WebDevelopment #CodingTips #Base64 #HTML #CSS #WebDesign #TechTips,https://fastimgtool.com/og-image.png,https://fastimgtool.com/guides/gif-to-png-guide-5.html
grayscale-vs-sepia.html,How to Convert an Image to Grayscale in Seconds,Our complete guide shows you why and how to convert images to black & white. Learn manual methods or use our free online tool for perfect results! #Grayscale #ImageEditing #BlackAndWhite #PhotoEditingTips #DesignTutorial #FreeTool #DigitalArt,https://fastimgtool.com/og-image.png,https://fastimgtool.com/guides/grayscale-vs-sepia.html
heic-to-jpg-guide-1.html,How to Convert JPG to PNG for Perfect Images,"Stop losing image quality! Learn exactly when and how to convert JPG to PNG for logos, graphics, and transparent backgrounds. Our ultimate guide has all the steps. #JPGtoPNG #ImageConversion #GraphicDesignTips #PNGvsJPG #DigitalMarketing #PhotoEditing #TechHowTo",https://fastimgtool.com/og-image.png,https://fastimgtool.com/guides/heic-to-jpg-guide-1.html
heic-to-jpg-guide-2.html,How to Convert PNG to JPG: The Ultimate 2024 Guide,Stop struggling with slow sites & large files! Our ultimate guide shows you exactly how to convert PNG to JPG for better performance and compatibility. Step-by-step instructions & pro tips inside. #PNGtoJPG #ImageConversion #FileFormat #WebOptimization #DigitalMarketing #TechTips #Productivity,https://fastimgtool.com/og-image.png,https://fastimgtool.com/guides/heic-to-jpg-guide-2.html
heic-to-jpg-guide-3.html,How to Convert WEBP to JPG Easily (Free Tool!),Stuck with a WEBP file? Our complete guide shows you the fastest way to convert it to a universal JPG. Learn the best free tool and pro tips for perfect quality every time. #WEBPtoJPG #ImageConverter #FreeTool #DigitalMarketing #GraphicDesign #TechTips #ProductivityHack,https://fastimgtool.com/og-image.png,https://fastimgtool.com/guides/heic-to-jpg-guide-3.html
heic-to-jpg-guide-4.html,Stuck with HEIC? Convert to JPG in Seconds! 🖼️➡️📸,Our free online tool makes converting iPhone HEIC images to universal JPG format quick and easy. Get step-by-step instructions and solve your cross-platform photo problems! #HEICtoJPG #ConvertHEIC #iPhoneTips #PhotoEditing #TechHowTo #WindowsHelp #FreeOnlineTool,https://fastimgtool.com/og-image.png,https://fastimgtool.com/guides/heic-to-jpg-guide-4.html
heic-to-jpg-guide-5.html,Convert Images to Base64: The Ultimate Developer Guide,Learn to encode HEIC & other images into Base64 strings for web projects. Step-by-step guide for optimal performance. #Base64 #WebDevelopment #CodingTips #HEIC #WebDesign #DeveloperTools #FrontEnd,https://fastimgtool.com/og-image.png,https://fastimgtool.com/guides/heic-to-jpg-guide-5.html
how-to-blur-image-online.html,How to Blur an Image Online for Free (2024 Guide),"Learn to hide sensitive info or add artistic blur to images in seconds. Our complete free guide shows you the easiest methods, no software download needed! #BlurImage #PhotoEditing #OnlineEditor #FreeTools #Privacy #DigitalArt #HowToGuide",https://fastimgtool.com/og-image.png,https://fastimgtool.com/guides/how-to-blur-image-online.html
how-to-compress-image-online.html,How to Compress Images Online for Free (2024 Guide),"Stop slow websites & email errors! Our ultimate guide shows you exactly how to reduce image file size for free. Master compression tools, pro tips, and alternative methods. #ImageCompression #FreeTools #WebOptimization #DigitalMarketing #BloggingTips #Productivity #HowToGuide",https://fastimgtool.com/og-image.png,https://fastimgtool.com/guides/how-to-compress-image-online.html
how-to-convert-image-to-grayscale.html,Master Monochrome: Your Guide to Perfect Grayscale Images,"Learn the art of black & white photography! Our complete guide shows you how to convert images to grayscale for stunning, timeless visuals. #grayscalephotography #blackandwhiteedit #monochrometips #photoguide #imageediting #designinspiration #photographyhacks",https://fastimgtool.com/og-image.png,https://fastimgtool.com/guides/how-to-convert-image-to-grayscale.html
